{
  "specversion": 4,
  "name": "XML",
  "doc": "Robot Framework library for verifying and modifying XML documents.\n\nAs the name implies, *XML* is a library for verifying contents of XML files.\nIn practice, it is a pretty thin wrapper on top of Python's\n[ElementTree XML API].\n\nThe library has the following main usages:\n\n- Parsing an XML file, or a string containing XML, into an XML element\n  structure and finding certain elements from it for further analysis\n  (e.g. [Parse XML] and [Get Element] keywords).\n- Getting text or attributes of elements\n  (e.g. [Get Element Text] and [Get Element Attribute]).\n- Directly verifying text, attributes, or whole elements\n  (e.g [Element Text Should Be] and [Elements Should Be Equal]).\n- Modifying XML and saving it (e.g. [Set Element Text], [Add Element]\n  and [Save XML]).\n\n### Table of contents\n\n%TOC%\n\n# Parsing XML\n\nXML can be parsed into an element structure using [Parse XML] keyword.\nThe XML to be parsed can be specified using a path to an XML file or as\na string or bytes that contain XML directly. The keyword returns the root\nelement of the structure, which then contains other elements as its\nchildren and their children. Possible comments and processing instructions\nin the source XML are removed.\n\nXML is not validated during parsing even if it has a schema defined. How\npossible doctype elements are handled otherwise depends on the used XML\nmodule and on the platform. The standard ElementTree strips doctypes\naltogether, but when [using lxml] they are preserved when XML is saved.\n\nThe element structure returned by [Parse XML], as well as elements\nreturned by keywords such as [Get Element], can be used as the `source`\nargument with other keywords. In addition to an already parsed XML\nstructure, other keywords also accept paths to XML files and strings\ncontaining XML similarly as [Parse XML]. Notice that keywords that modify\nXML do not write those changes back to disk even if the source would be\ngiven as a path to a file. Changes must always be saved explicitly using\n[Save XML] keyword.\n\nWhen the source is given as a path to a file, the forward slash character\n(`/`) can be used as the path separator regardless the operating system.\nOn Windows also the backslash works, but in the data it needs to be\nescaped by doubling it (`\\\\`). Using the built-in variable `${/}`\nnaturally works too.\n\n# Using lxml\n\nBy default, this library uses Python's standard [ElementTree] module for\nparsing XML, but it can be configured to use [lxml] module instead when\n[importing] the library. The resulting element structure has same API\nregardless which module is used for parsing.\n\nThe main benefits of using lxml is that it supports richer xpath syntax\nthan the standard ElementTree and enables using [Evaluate Xpath] keyword.\nIt also preserves the doctype and possible namespace prefixes saving XML.\n\n# Example\n\nThe following simple example demonstrates parsing XML and verifying its\ncontents. How to use xpath expressions to find elements and what attributes\nthe returned elements contain are discussed, with more examples, in\n[Finding elements with xpath] and [Element attributes] sections.\n\nIn this example, as well as in many other examples in this documentation,\n`${XML}` refers to the following example XML document. In practice `${XML}`\ncould either be a path to an XML file or it could contain the XML itself.\n\n```xml\n<example>\n    <first id=\"1\">text</first>\n    <second id=\"2\">\n        <child />\n    </second>\n    <third>\n        <child>more text</child>\n        <second id=\"child\" />\n        <child>\n            <grandchild />\n        </child>\n    </third>\n    <html>\n        <p>\n            Text with <b>bold</b> and <i>italics</i>.\n        </p>\n    </html>\n</example>\n```\n\n```robotframework\n*** Settings ***\nLibrary         XML    use_xml=True\n\n*** Test Cases ***\nExample\n    ${root} =    Parse XML    ${XML}\n    Should Be Equal    ${root.tag}    example\n    ${first} =    Get Element    ${root}    first\n    Should Be Equal    ${first.text}    text\n    Element Text Should Be    ${first}    text\n    Element Attribute Should Be    ${first}    id    1\n    Element Attribute Should Be    ${root}     id    1    xpath=first\n    Element Attribute Should Be    ${XML}      id    1    xpath=first\n```\n\nNotice that in the example three last lines are equivalent. Which one to\nuse in practice depends on which other elements you need to get or verify.\nIf you only need to do one verification, using the last line alone would\nsuffice. If more verifications are needed, parsing the XML with [Parse XML]\nonly once would be more efficient.\n\n# Finding elements with xpath\n\nElementTree, and thus also this library, supports finding elements using\nxpath expressions. ElementTree does not, however, support the full xpath\nstandard. The supported xpath syntax is explained below and\n[ElementTree documentation] provides more details. In the examples\n`${XML}` refers to the same XML structure as in the earlier example.\n\nIf lxml support is enabled when [importing] the library, the whole\n[xpath 1.0 standard] is supported. That includes everything listed below\nbut also a lot of other useful constructs.\n\n## Tag names\n\nWhen just a single tag name is used, xpath matches all direct child\nelements that have that tag name.\n\n```robotframework\n*** Test Cases ***\nTag names\n    ${elem} =    Get Element    ${XML}    third\n    Should Be Equal    ${elem.tag}    third\n    @{children} =    Get Elements    ${elem}    child\n    Length Should Be    ${children}    2\n```\n\n## Paths\n\nPaths are created by combining tag names with a forward slash (`/`). For\nexample, `parent/child` matches all `child` elements under `parent`\nelement. Notice that if there are multiple `parent` elements that all\nhave `child` elements, `parent/child` xpath will match all these\n`child` elements.\n\n```robotframework\n*** Test Cases ***\nPaths\n    ${elem} =    Get Element    ${XML}    second/child\n    Should Be Equal    ${elem.tag}    child\n    ${elem} =    Get Element    ${XML}    third/child/grandchild\n    Should Be Equal    ${elem.tag}    grandchild\n```\n\n## Wildcards\n\nAn asterisk (`*`) can be used in paths instead of a tag name to denote\nany element.\n\n```robotframework\n*** Test Cases ***\nWildcards\n    @{children} =    Get Elements    ${XML}    */child\n    Length Should Be    ${children}    3\n```\n\n## Current element\n\nThe current element is denoted with a dot (`.`). Normally the current\nelement is implicit and does not need to be included in the xpath.\n\n## Parent element\n\nThe parent element of another element is denoted with two dots (`..`).\nNotice that it is not possible to refer to the parent of the current\nelement.\n\n```robotframework\n*** Test Cases ***\nParent element\n    ${elem} =    Get Element    ${XML}    */second/..\n    Should Be Equal    ${elem.tag}    third\n```\n\n## Search all sub elements\n\nTwo forward slashes (`//`) mean that all sub elements, not only the\ndirect children, are searched. If the search is started from the current\nelement, an explicit dot is required.\n\n```robotframework\n*** Test Cases ***\nSearch all sub elements\n    @{elements} =    Get Elements    ${XML}    .//second\n    Length Should Be    ${elements}    2\n    ${b} =    Get Element    ${XML}    html//b\n    Should Be Equal    ${b.text}    bold\n```\n\n## Predicates\n\nPredicates allow selecting elements using also other criteria than tag\nnames, for example, attributes or position. They are specified after the\nnormal tag name or path using syntax `path[predicate]`. The path can have\nwildcards and other special syntax explained earlier. What predicates\nthe standard ElementTree supports is explained in the table below.\n\n|    Predicate    |                    Matches                            |          Example          |\n| --------------- | ------------------------------------------------------| ------------------------- |\n| `@attr`         | Elements with attribute `attr`.                       | `second[@id]`             |\n| `@attr=\"value\"` | Elements with attribute `attr` having value `value`.  | `*[@id=\"2\"]`              |\n| `position`      | Elements at the specified position.                   | `third/child[1]`          |\n| `tag`           | Elements with a child element named `tag`.            | `third/child[grandchild]` |\n\n`position` can be an integer starting from 1, expression `last()`, or\na relative expression like `last() - 1`.\n\nPredicates can also be stacked like `path[predicate1][predicate2]`.\nA limitation is that possible position predicate must always be first.\n\n# Element attributes\n\nAll keywords returning elements, such as [Parse XML], and [Get Element],\nreturn ElementTree's [Element objects]. These elements can be used as\ninputs for other keywords, but they also contain several useful attributes\nthat can be accessed directly using the extended variable syntax.\n\nThe attributes that are both useful and convenient to use in the data\nare explained below. Other attributes, including methods, can also\nbe accessed, but that is typically better to do in custom libraries than\ndirectly in the data.\n\nThe examples use the same `${XML}` structure as the earlier examples.\n\n## tag\n\nThe tag of the element.\n\n```robotframework\n*** Test Cases ***\nTag\n    ${root} =    Parse XML    ${XML}\n    Should Be Equal    ${root.tag}    example\n```\n\n## text\n\nThe text that the element contains or Python `None` if the element has no\ntext. Notice that the text *does not* contain texts of possible child\nelements nor text after or between children. Notice also that in XML\nwhitespace is significant, so the text contains also possible indentation\nand newlines. To get also text of the possible children, optionally\nwhitespace normalized, use [Get Element Text] keyword.\n\n```robotframework\